{
  "capability_id": "com.example.execution.echo",
  "capability_version": "1",
  "input_schema": {
    "type": "string"
  },
  "output_schema": {
    "type": "string"
  },
  "config_schema": {
    "type": "object",
    "additionalProperties": false
  },
  "lifecycle_features": {
    "streaming": true,
    "cancellation": true,
    "deadlines": true,
    "resource_reporting": true
  }
}
